{"schema_version": 1, "a2dlc_version": "0.1.0", "verdict": "INCONCLUSIVE", "base_ref": "9d45962efcf863c3befa0b39d5748ede2ae5870e",
 "tree_hash": "git-tree:4b825dc642cb6eb9a060e54bf8d69288fbee4904", "created_at": "2026-10-16T12:00:00Z",
 "targets": [], "out_of_scope": [{"file": "README.md", "reason": "no_engine"}],
 "engine_errors": [{"language": "python", "files": ["src/plenum/io.py"], "error": "the engine did not write /io/response.json (exit 137)"}],
 "pending_waivers": []}
