{"schema_version": 1, "a2dlc_version": "0.3.0", "verdict": "PASS", "base_ref": "9d45962efcf863c3befa0b39d5748ede2ae5870e",
 "tree_hash": "git-tree:351f8a6a0b1c2d3e4f5061728394a5b6c7d8e9f0", "created_at": "2026-10-17T12:00:00Z",
 "stage": "4", "contract_hash": "sha256:4b825dc642cb6eb9a060e54bf8d69288fbee4904a0b1c2d3e4f5061728394a5b",
 "targets": [{"target": "src/calc.py::media", "engine": "crosshair-diffbehavior", "engine_version": "0.0.111",
   "verdict": "PASS", "search_budget": {"iterations": 216, "per_condition_timeout_s": 10}, "generators": "typed_default", "typed": true,
   "domain_guard": null, "equivalence": "strict", "counterexample": null, "waived": false}],
 "out_of_scope": [],
 "pending_waivers": []}
